{
  "id": "lookback-transcriptions",
  "name": "Lookback — Transcriptions",
  "slug": "lookback-transcriptions",
  "logo_url": "https://lookback.io/favicon.ico",
  "icon_url": "https://lookback.io/favicon.ico",
  "images": [
    "https://lookback.io/favicon.ico"
  ],
  "website_url": "https://lookback.io",
  "tagline": "User research recording with transcripts and notes.",
  "summary": "Lookback — Transcriptions supports researchers with automatic transcripts, tagging, and repositories to synthesize insights from interviews and tests.",
  "main_category": "Speech-to-Text / ASR",
  "subcategory": null,
  "categories": [
    "Speech-to-Text",
    "Media AI",
    "Developer Tools"
  ],
  "tasks": [
    "Transcription",
    "Tagging",
    "Repository"
  ],
  "use_cases": [
    "User research",
    "Interviews",
    "Qualitative analysis"
  ],
  "best_for": [
    "Builders & teams needing STT"
  ],
  "ideal_industries": [],
  "roles": [],
  "job_roles": [],
  "models": [
    "ASR engine or service (varies)"
  ],
  "platforms": [
    "APIs/SDKs/Apps (varies)"
  ],
  "languages": [
    "Varies by vendor"
  ],
  "integrations": [],
  "compliance": [],
  "data_controls": [],
  "governance": [],
  "security": {
    "certifications": [],
    "sso": null
  },
  "technical": {
    "context_tokens": null,
    "latency_ms": null,
    "throughput_rps": null,
    "sdk_languages": []
  },
  "benchmarks": {
    "latency_ms_p50": null,
    "latency_ms_p95": null,
    "note": null
  },
  "privacy": {
    "training_policy": null,
    "data_retention": null
  },
  "limits": {
    "free_tier": null,
    "rate_limits": null
  },
  "uptime_slo": null,
  "pricing": {
    "model": null,
    "plans": []
  },
  "pricing_notes": null,
  "pros_cons": {
    "pros": [],
    "cons": []
  },
  "key_differentiators": [],
  "limitations": [],
  "import_export": [],
  "setup_time": "Minutes",
  "case_studies": [],
  "migration_paths": [],
  "roadmap_highlights": [],
  "alternatives_notes": null,
  "vendor": {
    "name": "Lookback",
    "hq_country": null,
    "twitter": null,
    "linkedin": "https://www.linkedin.com/company/lookback-io/",
    "contact_email": null
  },
  "links": {
    "pricing": null,
    "docs": "https://lookback.io",
    "changelog": null,
    "support": "https://lookback.io"
  },
  "release_date": null,
  "updated_at": "2025-10-12T00:55:03Z",
  "status": "active",
  "flags": {
    "free": false,
    "open_source": false,
    "no_signup": false,
    "api_available": true,
    "mobile_app": false,
    "privacy_first": false,
    "verified": true
  },
  "community": {
    "rating": null,
    "votes": null,
    "reviews": []
  },
  "gallery": [
    {
      "src": "https://lookback.io/favicon.ico",
      "caption": "Lookback — Transcriptions icon"
    }
  ],
  "tutorials": [],
  "q_and_a": []
}