{
  "id": "calabrio-analytics",
  "name": "Calabrio Analytics",
  "slug": "calabrio-analytics",
  "logo_url": "https://www.calabrio.com/favicon.ico",
  "icon_url": "https://www.calabrio.com/favicon.ico",
  "images": [
    "https://www.calabrio.com/favicon.ico"
  ],
  "website_url": "https://www.calabrio.com",
  "tagline": "WEM suite with analytics from call transcripts.",
  "summary": "Calabrio Analytics provides conversation analytics that rely on ASR to generate searchable transcripts for QA, coaching, and compliance.",
  "main_category": "Speech-to-Text / ASR",
  "subcategory": null,
  "categories": [
    "Speech-to-Text",
    "Media AI",
    "Developer Tools"
  ],
  "tasks": [
    "Transcription",
    "Captions",
    "Timestamps"
  ],
  "use_cases": [
    "Meetings",
    "Media",
    "Apps"
  ],
  "best_for": [
    "Teams & developers needing STT"
  ],
  "ideal_industries": [],
  "roles": [],
  "job_roles": [],
  "models": [
    "ASR engine/service (varies)"
  ],
  "platforms": [
    "APIs/SDKs/Apps (varies)"
  ],
  "languages": [
    "Varies by vendor"
  ],
  "integrations": [],
  "compliance": [],
  "data_controls": [],
  "governance": [],
  "security": {
    "certifications": [],
    "sso": null
  },
  "technical": {
    "context_tokens": null,
    "latency_ms": null,
    "throughput_rps": null,
    "sdk_languages": []
  },
  "benchmarks": {
    "latency_ms_p50": null,
    "latency_ms_p95": null,
    "note": null
  },
  "privacy": {
    "training_policy": null,
    "data_retention": null
  },
  "limits": {
    "free_tier": null,
    "rate_limits": null
  },
  "uptime_slo": null,
  "pricing": {
    "model": null,
    "plans": []
  },
  "pricing_notes": null,
  "pros_cons": {
    "pros": [],
    "cons": []
  },
  "key_differentiators": [],
  "limitations": [],
  "import_export": [],
  "setup_time": "Minutes",
  "case_studies": [],
  "migration_paths": [],
  "roadmap_highlights": [],
  "alternatives_notes": null,
  "vendor": {
    "name": "Calabrio",
    "hq_country": null,
    "twitter": "https://twitter.com/Calabrio",
    "linkedin": "https://www.linkedin.com/company/calabrio-inc-/",
    "contact_email": null
  },
  "links": {
    "pricing": null,
    "docs": "https://www.calabrio.com",
    "changelog": null,
    "support": "https://www.calabrio.com"
  },
  "release_date": null,
  "updated_at": "2025-10-12T01:19:34Z",
  "status": "active",
  "flags": {
    "free": false,
    "open_source": false,
    "no_signup": false,
    "api_available": true,
    "mobile_app": false,
    "privacy_first": false,
    "verified": true
  },
  "community": {
    "rating": null,
    "votes": null,
    "reviews": []
  },
  "gallery": [
    {
      "src": "https://www.calabrio.com/favicon.ico",
      "caption": "Calabrio Analytics icon"
    }
  ],
  "tutorials": [],
  "q_and_a": []
}