{
  "id": "zoom-contact-center-transcription",
  "name": "Zoom Contact Center (Transcription)",
  "slug": "zoom-contact-center-transcription",
  "logo_url": "https://explore.zoom.us/en/contactcenter/favicon.ico",
  "icon_url": "https://explore.zoom.us/en/contactcenter/favicon.ico",
  "images": [
    "https://explore.zoom.us/en/contactcenter/favicon.ico"
  ],
  "website_url": "https://explore.zoom.us/en/contactcenter/",
  "tagline": "Omnichannel contact center with transcripts, analytics, and QA.",
  "summary": "Zoom Contact Center includes transcription for voice interactions with analytics and QA features. It connects with Zoomâ€™s ecosystem and CRMs for integrated workflows.",
  "main_category": "Speech-to-Text / ASR",
  "subcategory": null,
  "categories": [
    "Speech-to-Text",
    "Media AI",
    "Developer Tools"
  ],
  "tasks": [
    "Transcription",
    "Analytics",
    "QA"
  ],
  "use_cases": [
    "Contact centers",
    "Coaching",
    "Compliance"
  ],
  "best_for": [
    "Zoom-centric orgs"
  ],
  "ideal_industries": [],
  "roles": [],
  "job_roles": [],
  "models": [
    "ASR + analytics (platform)"
  ],
  "platforms": [
    "Zoom CC",
    "APIs/Integrations"
  ],
  "languages": [
    "Selected locales (see docs)"
  ],
  "integrations": [],
  "compliance": [],
  "data_controls": [],
  "governance": [],
  "security": {
    "certifications": [],
    "sso": null
  },
  "technical": {
    "context_tokens": null,
    "latency_ms": null,
    "throughput_rps": null,
    "sdk_languages": []
  },
  "benchmarks": {
    "latency_ms_p50": null,
    "latency_ms_p95": null,
    "note": null
  },
  "privacy": {
    "training_policy": null,
    "data_retention": null
  },
  "limits": {
    "free_tier": null,
    "rate_limits": null
  },
  "uptime_slo": null,
  "pricing": {
    "model": null,
    "plans": []
  },
  "pricing_notes": null,
  "pros_cons": {
    "pros": [],
    "cons": []
  },
  "key_differentiators": [],
  "limitations": [],
  "import_export": [],
  "setup_time": "Minutes",
  "case_studies": [],
  "migration_paths": [],
  "roadmap_highlights": [],
  "alternatives_notes": null,
  "vendor": {
    "name": "Zoom Video Communications",
    "hq_country": null,
    "twitter": "https://twitter.com/Zoom",
    "linkedin": "https://www.linkedin.com/company/zoom-video-communications/",
    "contact_email": null
  },
  "links": {
    "pricing": "https://explore.zoom.us/en/contactcenter/plans/",
    "docs": "https://support.zoom.us",
    "changelog": null,
    "support": "https://support.zoom.us"
  },
  "release_date": null,
  "updated_at": "2025-10-12T00:29:55Z",
  "status": "active",
  "flags": {
    "free": false,
    "open_source": false,
    "no_signup": false,
    "api_available": true,
    "mobile_app": false,
    "privacy_first": false,
    "verified": true
  },
  "community": {
    "rating": null,
    "votes": null,
    "reviews": []
  },
  "gallery": [
    {
      "src": "https://explore.zoom.us/en/contactcenter/favicon.ico",
      "caption": "Zoom Contact Center (Transcription) icon"
    }
  ],
  "tutorials": [],
  "q_and_a": []
}